{
  "experiment_id": "EXP-2026-03-21-001",
  "instrument": {
    "name": "IFS 125HR",
    "manufacturer": "Bruker",
    "resolution_cm-1": 0.001
  },
  "operator": {
    "name": "Dr. Domenico Prudenzano",
    "lab": "DrumBeat Spectroscopy Lab"
  },
  "measurement": {
    "date": "2026-03-21T10:15:00Z",
    "location": "Munich",
    "temperature_C": 18.4,
    "pressure_hPa": 1012.3
  },
  "scan_parameters": {
    "number_of_scans": 128,
    "scan_velocity_kHz": 10,
    "apodization": "Happ-Genzel"
  },
  "spectrum": {
    "wavenumber_range_cm-1": [4100, 4500],
    "data_file": "spectra/exp_20260321_001.dat"
  }
}
